name,latitude,longitude,description,link,icon
"Esquipulas",14.5632,-89.3555,"Esquipulas is home to the revered Black Christ of Esquipulas, Central America's most important Catholic pilgrimage destination, drawing millions of faithful annually to venerate the miraculous dark wooden crucifix.","","https://raw.githubusercontent.com/mmm777/destinationes-places/main/blue%20flag%20light.png"
"Champion",44.5906094,-87.773566,"Champion, Wisconsin hosts America's only Church-approved Marian apparition site, where the Blessed Virgin Mary appeared to Adele Brise in 1859.","","https://raw.githubusercontent.com/mmm777/destinationes-places/main/blue%20flag%20light.png"
"San Francisco",37.7988332,-122.4077204,"San Francisco offers unique Catholic pilgrimage opportunities with the historic National Shrine of St. Francis of Assisi, established in 1849 and featuring a replica of Assisi's Porziuncola chapel for spiritual renewal without traveling to Italy.","","https://raw.githubusercontent.com/mmm777/destinationes-places/main/blue%20flag%20light.png"
"Trois-Rivières",46.3688393,-72.4977046,"Home to Canada's national shrine to the Blessed Virgin Mary, Notre-Dame-du-Cap Basilica draws thousands of Catholic pilgrims annually to this sacred Marian site.","","https://raw.githubusercontent.com/mmm777/destinationes-places/main/blue%20flag%20light.png"
"St. Augustine",29.9047221,-81.3152382,"St. Augustine hosts America's oldest Catholic pilgrimage site, the National Shrine of Our Lady of La Leche, offering 450+ years of faith history and spiritual heritage.","","https://raw.githubusercontent.com/mmm777/destinationes-places/main/blue%20flag%20light.png"
"San Juan Capistrano",33.5042352,-117.6634736,"Mission Basilica San Juan Capistrano, founded in 1776, stands as California's oldest church still in use and serves as an official National Shrine for Catholic pilgrims seeking spiritual renewal.","","https://raw.githubusercontent.com/mmm777/destinationes-places/main/blue%20flag%20light.png"
"Auriesville",42.9251757,-74.3021888,"Auriesville is the sacred site where three Jesuit missionaries were martyred in 1642-1646, and the birthplace of St. Kateri Tekakwitha, the 'Lily of the Mohawks'","","https://raw.githubusercontent.com/mmm777/destinationes-places/main/blue%20flag%20light.png"
"Washington, D.C.",38.9333675,-77.0006569,"Washington, D.C. offers America's premier Catholic pilgrimage experience with the magnificent National Shrine of the Immaculate Conception, the largest church in North America.","","https://raw.githubusercontent.com/mmm777/destinationes-places/main/blue%20flag%20light.png"
"El Cobre",20.0508568,-75.9489842,"El Cobre houses Cuba's National Shrine Basilica of Our Lady of Charity, the patroness of Cuba. This sacred site draws pilgrims seeking the Virgin's intercession since the 17th century.","","https://raw.githubusercontent.com/mmm777/destinationes-places/main/blue%20flag%20light.png"
"Hormigueros",18.1406498,-67.12705319999999,"Hormigueros is renowned as a Catholic pilgrimage destination centered around the historic Basilica of Our Lady of Monserrate, a minor basilica that has drawn faithful devotees for centuries.","","https://raw.githubusercontent.com/mmm777/destinationes-places/main/blue%20flag%20light.png"
"Emmitsburg",39.6989248,-77.3264291,"Emmitsburg hosts two major Catholic shrines honoring America's first native-born saint and Our Lady of Lourdes, drawing thousands of pilgrims annually to this sacred Maryland town.","","https://raw.githubusercontent.com/mmm777/destinationes-places/main/blue%20flag%20light.png"
"Mexico City",19.4847897,-99.11787419999999,"Mexico City houses the world's most visited Catholic shrine, the Basilica of Our Lady of Guadalupe, where millions annually honor the Virgin's miraculous appearance to St. Juan Diego in 1531.","","https://raw.githubusercontent.com/mmm777/destinationes-places/main/blue%20flag%20light.png"
"Suyapa",14.0804358,-87.1573816,"Home to Honduras' patron saint, Our Lady of Suyapa draws thousands of pilgrims annually to venerate the miraculous 18th-century cedar statue and seek her intercession.","","https://raw.githubusercontent.com/mmm777/destinationes-places/main/blue%20flag%20light.png"
"Carmel-by-the-Sea",36.5429357,-121.9200502,"Carmel-by-the-Sea is home to the historic Carmel Mission Basilica, final resting place of St. Junipero Serra and one of America's most popular Catholic pilgrimage sites.","","https://raw.githubusercontent.com/mmm777/destinationes-places/main/blue%20flag%20light.png"
"Higüey",18.6155552,-68.7168797,"Higüey is home to the sacred Basilica of Our Lady of Altagracia, the spiritual heart of Dominican Catholicism and Caribbean pilgrimage.","","https://raw.githubusercontent.com/mmm777/destinationes-places/main/blue%20flag%20light.png"
"Midland",44.7366816,-79.8421388,"Midland is home to the National Shrine of the Canadian Martyrs, honoring eight Jesuit saints who died for their faith over 350 years ago in Ontario.","","https://raw.githubusercontent.com/mmm777/destinationes-places/main/blue%20flag%20light.png"
"San Salvador",13.698274,-89.1911126,"San Salvador stands as a significant Catholic pilgrimage destination, home to the tomb of Saint Óscar Romero and the revered Cathedral of San Salvador.","","https://raw.githubusercontent.com/mmm777/destinationes-places/main/blue%20flag%20light.png"
"Tlaxcala",19.3180271,-98.2281613,"Tlaxcala is home to two major Catholic pilgrimage sites: the Basilica of Our Lady of Ocotlán and the Shrine of San Miguel del Milagro, drawing faithful seeking miracles.","","https://raw.githubusercontent.com/mmm777/destinationes-places/main/blue%20flag%20light.png"
"Baltimore",39.2944188,-76.6165816,"Baltimore holds special significance as America's first Catholic diocese and home to the historic Baltimore Basilica, a National Shrine that invites pilgrims to explore the roots of Catholicism in the United States.","","https://raw.githubusercontent.com/mmm777/destinationes-places/main/blue%20flag%20light.png"
"San Diego",32.7211348,-117.1615388,"San Diego offers Catholic pilgrims significant historic sites including the first California mission and the beautiful St. Joseph Cathedral, making it a meaningful West Coast pilgrimage destination.","","https://raw.githubusercontent.com/mmm777/destinationes-places/main/blue%20flag%20light.png"
"Cairo",30.0935707,31.3251828,"Cairo offers profound Catholic pilgrimage sites connected to the Holy Family's flight to Egypt and ancient Christian heritage. Catholic pilgrims visit sacred churches and historical sites throughout the city.","","https://raw.githubusercontent.com/mmm777/destinationes-places/main/blue%20flag%20light.png"
"Flüeli-Ranft",46.87235,8.2681194,"Flüeli-Ranft is the sacred homeland of Switzerland's national saint Nicholas of Flüe (Brother Klaus), where pilgrims seek spiritual guidance at his birthplace and hermitage.","","https://raw.githubusercontent.com/mmm777/destinationes-places/main/blue%20flag%20light.png"
"Serra San Bruno",38.5539858,16.3126069,"Home to Saint Bruno of Cologne's tomb and the renowned Carthusian monastery, Serra San Bruno offers pilgrims profound spiritual heritage and tranquility in Calabria's Serre Mountains.","","https://raw.githubusercontent.com/mmm777/destinationes-places/main/blue%20flag%20light.png"
"Mugnano del Cardinale",40.9411892,14.6424683,"Mugnano del Cardinale houses the sacred remains of Saint Philomena, making it a significant Catholic pilgrimage site renowned for miraculous healings and devotion.","","https://raw.githubusercontent.com/mmm777/destinationes-places/main/blue%20flag%20light.png"
"Allens Park",40.2470136,-105.5356612,"Saint Catherine's Chapel on the Rock is a historic Catholic chapel built atop a dramatic rock formation, serving as a spiritual landmark in the Colorado Rockies since 1936.","","https://raw.githubusercontent.com/mmm777/destinationes-places/main/blue%20flag%20light.png"
"Kolkata",22.553114,88.363772,"Kolkata offers Catholic pilgrims the sacred Mother House of Saint Teresa of Calcutta, where visitors can pray at her tomb and experience her legacy of compassion.","","https://raw.githubusercontent.com/mmm777/destinationes-places/main/blue%20flag%20light.png"
"Emittsburg",39.6989248,-77.3264291,"Emmitsburg is a sacred Catholic destination home to the National Shrine of Saint Elizabeth Ann Seton and the oldest Lourdes Grotto replica in America.","","https://raw.githubusercontent.com/mmm777/destinationes-places/main/blue%20flag%20light.png"
"Hulbert",36.0340813,-95.1957884,"Hulbert is home to Our Lady of Clear Creek Abbey, a Traditional Benedictine monastery that serves as the destination for the annual Three Hearts Pilgrimage.","","https://raw.githubusercontent.com/mmm777/destinationes-places/main/blue%20flag%20light.png"
"KwaZulu-Natal",-27.8553,31.4538,"KwaZulu-Natal hosts significant Catholic pilgrimage sites, most notably the Ngome Marian Shrine where Our Lady appeared as 'Tabernacle of the Most High'.","","https://raw.githubusercontent.com/mmm777/destinationes-places/main/blue%20flag%20light.png"
"New Haven",41.31192069999999,-72.9238237,"New Haven holds special significance for Catholic pilgrims as the birthplace of the Knights of Columbus and home to Blessed Michael McGivney's tomb.","","https://raw.githubusercontent.com/mmm777/destinationes-places/main/blue%20flag%20light.png"
"Juneau",58.47230930000001,-134.787191,"Juneau's National Shrine of St. Thérèse offers pilgrims a serene spiritual retreat overlooking Lynn Canal, featuring beautiful stone structures and devotional paths.","","https://raw.githubusercontent.com/mmm777/destinationes-places/main/blue%20flag%20light.png"
"Hansville",47.9175659,-122.5472438,"Hansville Community Church serves as a modest Christian worship site in this scenic coastal community.","","https://raw.githubusercontent.com/mmm777/destinationes-places/main/blue%20flag%20light.png"
"Tucson",32.1071807,-111.0079895,"Tucson offers Catholic pilgrims spiritual encounters at historic Mission San Xavier del Bac and the Byzantine Mary Undoer of Knots Shrine.","","https://raw.githubusercontent.com/mmm777/destinationes-places/main/blue%20flag%20light.png"
"Lacrosse",43.7543925,-91.1799939,"La Crosse is home to the magnificent Shrine of Our Lady of Guadalupe, a major Catholic pilgrimage site that draws faithful from across America seeking spiritual renewal and Marian devotion.","","https://raw.githubusercontent.com/mmm777/destinationes-places/main/blue%20flag%20light.png"
"San Nicolás",-33.32668,-60.23366,"San Nicolás is home to the Sanctuary of Our Lady of the Rosary, site of approved Marian apparitions and a major Catholic pilgrimage destination in Argentina.","","https://raw.githubusercontent.com/mmm777/destinationes-places/main/blue%20flag%20light.png"
"Mt. Koressos (Ephesus)",37.911723,27.334163,"Mount Koressos houses the Virgin Mary's final dwelling, a sacred Catholic pilgrimage site where tradition holds she spent her last years under St. John's care.","","https://raw.githubusercontent.com/mmm777/destinationes-places/main/blue%20flag%20light.png"
"Oklahoma City",35.3757068,-97.49746379999999,"Oklahoma City stands as a rising Catholic pilgrimage destination with the Blessed Stanley Rother Shrine honoring America's first priest-martyr.","","https://raw.githubusercontent.com/mmm777/destinationes-places/main/blue%20flag%20light.png"
"San Antonio",29.446085,-98.5254227,"San Antonio offers a rich Catholic pilgrimage experience through its historic Spanish missions and the National Shrine of the Little Flower, America's first shrine to St. Thérèse of Lisieux.","","https://raw.githubusercontent.com/mmm777/destinationes-places/main/blue%20flag%20light.png"
"Annaya",34.1207322,35.7539443,"Annaya is home to the Monastery of Saint Maron, containing the tomb of Saint Charbel Makhlouf, the renowned 19th-century Maronite monk known for miraculous healings.","","https://raw.githubusercontent.com/mmm777/destinationes-places/main/blue%20flag%20light.png"
"Carmemell",41.4354609,-74.43523449999999,"The National Shrine of Our Lady of Mount Carmel serves as a major Catholic pilgrimage site dedicated to Marian devotion and Carmelite spirituality.","","https://raw.githubusercontent.com/mmm777/destinationes-places/main/blue%20flag%20light.png"
