name,latitude,longitude,description,link,icon
"Manresa",41.7211856,1.8315823,"Manresa is a pivotal Catholic pilgrimage site where St. Ignatius of Loyola spent 11 months in 1522, developing his Spiritual Exercises in the sacred cave.","","https://raw.githubusercontent.com/mmm777/destinationes-places/main/blue%20flag%20light.png"
"Manoppello",42.2501,14.0624,"Manoppello is home to the Holy Face of Jesus, believed to be Veronica's Veil, drawing pilgrims to witness this miraculous image of Christ.","","https://raw.githubusercontent.com/mmm777/destinationes-places/main/blue%20flag%20light.png"
"Downpatrick",54.325279,-5.71296,"Downpatrick is revered as the burial place of Ireland's patron saint St Patrick, making it a significant Catholic pilgrimage destination in Northern Ireland.","","https://raw.githubusercontent.com/mmm777/destinationes-places/main/blue%20flag%20light.png"
"Lanciano",42.2304195,14.3900591,"Lanciano hosts the first recorded Eucharistic miracle in Catholic history, where host transformed to flesh and wine to blood in the 8th century.","","https://raw.githubusercontent.com/mmm777/destinationes-places/main/blue%20flag%20light.png"
"Aylesford",51.303429,0.471229,"Aylesford Priory, dating from 1242, is the oldest Carmelite foundation in England where St. Simon Stock received the Brown Scapular from Our Lady.","","https://raw.githubusercontent.com/mmm777/destinationes-places/main/blue%20flag%20light.png"
"St. David's",51.8819799,-5.2683444,"St. Davids Cathedral, housing the shrine of Wales' patron saint, was granted papal privilege making two pilgrimages equal to one to Rome in the 12th century.","","https://raw.githubusercontent.com/mmm777/destinationes-places/main/blue%20flag%20light.png"
"Bardo",50.505684,16.740324,"Bardo houses the miraculous 13th-century Madonna statue and Baroque pilgrimage church visited by Pope John Paul II, making it a significant Marian pilgrimage destination in Poland.","","https://raw.githubusercontent.com/mmm777/destinationes-places/main/blue%20flag%20light.png"
"Marianka",48.24802039999999,17.064569,"Marianka is Slovakia's oldest pilgrimage site, housing the miraculous statue of Virgin Mary and drawing faithful since medieval times.","","https://raw.githubusercontent.com/mmm777/destinationes-places/main/blue%20flag%20light.png"
"Święta Lipka",54.0246858,21.217932,"Święta Lipka is Poland's oldest Marian sanctuary, renowned for its miraculous Virgin Mary statue and stunning Baroque basilica, drawing Catholic pilgrims for centuries.","","https://raw.githubusercontent.com/mmm777/destinationes-places/main/blue%20flag%20light.png"
"Siena",43.320037,11.3288405,"Siena is home to St. Catherine of Siena, a Doctor of the Church, and contains her birthplace sanctuary and relics, making it a significant Catholic pilgrimage destination.","","https://raw.githubusercontent.com/mmm777/destinationes-places/main/blue%20flag%20light.png"
"Oropa",45.6260244,7.9824193,"The Sanctuary of Oropa is one of the oldest Marian shrines in the world, founded by Saint Eusebius around 371 AD in the Italian Alps.","","https://raw.githubusercontent.com/mmm777/destinationes-places/main/blue%20flag%20light.png"
"Nitra",48.3182964,18.0870789,"Nitra, Slovakia's oldest Christian center, houses St. Emmeram's Cathedral, dating to the 11th century. This historic pilgrimage destination offers deep spiritual significance as the seat of Slovakia's first Catholic diocese.","","https://raw.githubusercontent.com/mmm777/destinationes-places/main/blue%20flag%20light.png"
"Pontevedra",42.4308,-8.6436,"Pontevedra offers pilgrims two significant Marian sanctuaries along the Portuguese Camino route, hosting the Virgin of the Pilgrim and Fatima apparitions.","","https://raw.githubusercontent.com/mmm777/destinationes-places/main/blue%20flag%20light.png"
"Conques",44.5992546,2.3977344,"Conques is a major medieval pilgrimage destination on the Camino de Santiago, home to the magnificent Abbey Church of Sainte-Foy with its famous reliquary and Romanesque treasures.","","https://raw.githubusercontent.com/mmm777/destinationes-places/main/blue%20flag%20light.png"
"Bardsey Island (Ynys Enlli)",52.7642729,-4.7875708,"Bardsey Island, known as the 'Island of 20,000 Saints', has been a sacred Catholic pilgrimage destination since medieval times. Three pilgrimages here were considered equal to one to Rome.","","https://raw.githubusercontent.com/mmm777/destinationes-places/main/blue%20flag%20light.png"
"Lough Derg",54.6091701,-7.871807899999999,"Lough Derg is one of Ireland's most ancient pilgrimage sites, dating back to the 5th century, where St. Patrick established a place of prayer and spiritual renewal that continues to draw faithful seeking deeper connection with God.","","https://raw.githubusercontent.com/mmm777/destinationes-places/main/blue%20flag%20light.png"
"Canneto",41.8541154,14.6016941,"Canneto is home to the Sanctuary of Santa Maria del Canneto, a revered Marian pilgrimage site dating to the 12th-13th centuries with annual summer pilgrimages.","","https://raw.githubusercontent.com/mmm777/destinationes-places/main/blue%20flag%20light.png"
"Ludźmierz",49.4650669,19.9831381,"Ludźmierz houses Poland's oldest Marian shrine, featuring the miraculous statue of Our Lady of Ludźmierz, Queen of Podhale, venerated since medieval times.","","https://raw.githubusercontent.com/mmm777/destinationes-places/main/blue%20flag%20light.png"
"Trnava",48.3789556,17.5914303,"Trnava, known as the Slovak Rome, is a significant Catholic pilgrimage destination centered around the miraculous Merciful Virgin Mary of Trnava.","","https://raw.githubusercontent.com/mmm777/destinationes-places/main/blue%20flag%20light.png"
"Palermo",38.1680417,13.3514483,"Palermo offers Catholic pilgrims a profound spiritual journey centered on the Sanctuary of Santa Rosalia, patron saint who saved the city from plague and remains beloved throughout Sicily.","","https://raw.githubusercontent.com/mmm777/destinationes-places/main/blue%20flag%20light.png"
"Tindari",38.1414437,15.0461073,"Tindari is home to the renowned Sanctuary of the Black Madonna, an important Catholic pilgrimage site in northern Sicily dating back to the 11th century.","","https://raw.githubusercontent.com/mmm777/destinationes-places/main/blue%20flag%20light.png"
"Covadonga",43.3089,-5.0537,"Covadonga is a sacred Catholic pilgrimage site where Our Lady helped King Pelayo win the pivotal Battle of Covadonga in 718, marking the beginning of the Spanish Reconquista and making it Spain's most important Marian sanctuary.","","https://raw.githubusercontent.com/mmm777/destinationes-places/main/blue%20flag%20light.png"
"Oviedo",43.3625093,-5.8436718,"Oviedo is a historic Catholic pilgrimage site housing the Holy Sudarium of Christ and serving as the starting point of the original Camino Primitivo route to Santiago.","","https://raw.githubusercontent.com/mmm777/destinationes-places/main/blue%20flag%20light.png"
"Velankanni",10.6802962,79.8501118,"Velankanni is renowned as the 'Lourdes of the East,' drawing millions of Catholic pilgrims to honor Our Lady of Good Health and witness her miraculous apparitions.","www.destinationes.com/pilgrimage-sites/velankanni","https://raw.githubusercontent.com/mmm777/destinationes-places/main/blue%20flag%20light.png"
"Lisbon",38.7099722,-9.1338289,"Lisbon offers rich Catholic heritage as the birthplace of St. Anthony of Padua and gateway to Portugal's spiritual traditions, featuring sacred sites from ancient cathedral to modern sanctuaries.","","https://raw.githubusercontent.com/mmm777/destinationes-places/main/blue%20flag%20light.png"
"Santarem",39.2333631,-8.6819907,"Santarém is home to the famous Eucharistic Miracle of 1247, one of the most important Catholic pilgrimage sites in Portugal.","","https://raw.githubusercontent.com/mmm777/destinationes-places/main/blue%20flag%20light.png"
"La Verna",43.7070496,11.931128,"La Verna is the sacred mountain sanctuary where Saint Francis of Assisi received the stigmata in 1224, making it one of Christianity's most holy pilgrimage sites.","","https://raw.githubusercontent.com/mmm777/destinationes-places/main/blue%20flag%20light.png"
"Santa Maria degli Angeli",43.0578826,12.5801224,"Santa Maria degli Angeli is a major Catholic pilgrimage site housing the sacred Porziuncola chapel where St. Francis founded the Franciscan order.","","https://raw.githubusercontent.com/mmm777/destinationes-places/main/blue%20flag%20light.png"
"Guadalupe",19.4847897,-99.11787419999999,"Our Lady of Guadalupe shrine houses the miraculous tilma image of the Virgin Mary, site of her 1531 apparitions to Juan Diego.","","https://raw.githubusercontent.com/mmm777/destinationes-places/main/blue%20flag%20light.png"
"San Miguel del Milagro",19.2404059,-98.3331941,"Site of 1631 apparition of St. Michael the Archangel, with miraculous healing spring that continues to draw Catholic pilgrims seeking spiritual renewal.","","https://raw.githubusercontent.com/mmm777/destinationes-places/main/blue%20flag%20light.png"
"Cartago",9.8641018,-83.9130522,"Cartago is Costa Rica's most important Catholic pilgrimage site, home to the Basilica of Our Lady of the Angels where La Negrita, the nation's patron saint, is venerated.","","https://raw.githubusercontent.com/mmm777/destinationes-places/main/blue%20flag%20light.png"
"Nazareth",32.7021997,35.2974033,"Nazareth is Jesus' childhood home and the site of the Annunciation, where Gabriel told Mary she would bear the Son of God.","","https://raw.githubusercontent.com/mmm777/destinationes-places/main/blue%20flag%20light.png"
"Corrientes",-27.4694379,-58.8311243,"Corrientes serves as a significant Catholic center in northeastern Argentina, featuring the historic Our Lady of the Rosary Cathedral as its spiritual heart and main pilgrimage destination.","","https://raw.githubusercontent.com/mmm777/destinationes-places/main/blue%20flag%20light.png"
"Jalisco",21.2451933,-102.3341558,"Jalisco stands as one of Mexico's most important Catholic pilgrimage destinations, home to the renowned Basilica of San Juan de los Lagos with over 7 million annual pilgrims.","","https://raw.githubusercontent.com/mmm777/destinationes-places/main/blue%20flag%20light.png"
"Cebu City",10.2941085,123.9021057,"Cebu City holds profound Catholic significance as the birthplace of Christianity in the Philippines, home to the miraculous Santo Niño de Cebú and the country's oldest church.","","https://raw.githubusercontent.com/mmm777/destinationes-places/main/blue%20flag%20light.png"
"Washington, D.C.",38.9333675,-77.0006569,"Washington, D.C. serves as a significant Catholic pilgrimage destination, home to the largest Catholic church in North America and the nation's premier Marian shrine.","","https://raw.githubusercontent.com/mmm777/destinationes-places/main/blue%20flag%20light.png"
"Barcelona",41.4036299,2.1743558,"Barcelona offers Catholic pilgrims extraordinary spiritual heritage with Gaudí's masterpiece Sagrada Família and ancient Gothic churches in Catalonia's historic heart.","","https://raw.githubusercontent.com/mmm777/destinationes-places/main/blue%20flag%20light.png"
"La Vang",16.7067978,107.1955196,"La Vang is Vietnam's national Marian shrine where Our Lady appeared to persecuted Catholics in 1798, becoming the country's most important Catholic pilgrimage destination.","","https://raw.githubusercontent.com/mmm777/destinationes-places/main/blue%20flag%20light.png"
"New York City",40.7586117,-73.9761953,"New York City offers rich Catholic heritage with historic cathedrals and shrines, making it a significant pilgrimage destination for faithful visitors.","","https://raw.githubusercontent.com/mmm777/destinationes-places/main/blue%20flag%20light.png"
"Jerusalem",31.7784813,35.2296002,"Jerusalem stands as the heart of Christian faith, housing the Church of the Holy Sepulchre where Jesus was crucified, buried, and rose from the dead.","","https://raw.githubusercontent.com/mmm777/destinationes-places/main/blue%20flag%20light.png"
"Venice",45.4345606,12.3397124,"Venice offers Catholic pilgrims a unique spiritual journey through St. Mark's Basilica, housing sacred relics of St. Mark the Evangelist and centuries of Christian heritage.","","https://raw.githubusercontent.com/mmm777/destinationes-places/main/blue%20flag.png"
"Naga City",13.6320521,123.1999808,"Naga City, known as the Pilgrim City, is home to one of Asia's largest Marian pilgrimage sites centered on devotion to Our Lady of Peñafrancia.","","https://raw.githubusercontent.com/mmm777/destinationes-places/main/blue%20flag%20light.png"
"Sant'Ambrogio di Torino",45.096365,7.3422282,"Home to the renowned Sacra di San Michele abbey, this medieval pilgrimage site honors Archangel Michael along ancient European routes.","","https://raw.githubusercontent.com/mmm777/destinationes-places/main/blue%20flag%20light.png"
"Aparecida",-22.8505334,-45.23372579999999,"Aparecida is Brazil's most important Marian pilgrimage site, home to the National Shrine of Our Lady Aparecida, the patroness of Brazil, with millions of annual visitors.","","https://raw.githubusercontent.com/mmm777/destinationes-places/main/blue%20flag%20light.png"
"Manila",14.5917422,120.9733921,"Manila stands as a premier Catholic pilgrimage destination in Asia, home to the historic Manila Cathedral and revered Black Nazarene shrine that draw millions of faithful annually.","","https://raw.githubusercontent.com/mmm777/destinationes-places/main/blue%20flag%20light.png"
"Harissa",33.9816726,35.6513353,"Harissa is home to the National Shrine of Our Lady of Lebanon, the premier Catholic pilgrimage site in Lebanon with a famous Marian statue.","","https://raw.githubusercontent.com/mmm777/destinationes-places/main/blue%20flag%20light.png"
"Panormitis",36.5483514,27.8462657,"While primarily an Orthodox site, Panormitis Monastery attracts Catholic pilgrims seeking to honor Archangel Michael, one of Christianity's most revered celestial beings.","","https://raw.githubusercontent.com/mmm777/destinationes-places/main/blue%20flag%20light.png"
"Haifa - Mount Carmel",32.82723530000001,34.9701292,"Mount Carmel in Haifa is sacred to Catholics as the home of Elijah's Cave and the world headquarters of the Carmelite Order, founded by hermits in the 12th century.","","https://raw.githubusercontent.com/mmm777/destinationes-places/main/blue%20flag%20light.png"
"Goa",15.5008429,73.9114097,"Goa is a premier Catholic pilgrimage destination housing the sacred relics of St. Francis Xavier, drawing millions to its historic Portuguese colonial churches.","","https://raw.githubusercontent.com/mmm777/destinationes-places/main/blue%20flag%20light.png"
"Las Lajas",0.8054536,-77.5858583,"Las Lajas Sanctuary is a renowned Catholic pilgrimage site dedicated to Our Lady of Las Lajas, featuring a miraculous Marian image and stunning neo-Gothic architecture.","","https://raw.githubusercontent.com/mmm777/destinationes-places/main/blue%20flag%20light.png"
"Milan",45.4640976,9.1919265,"Milan holds profound Catholic significance as the seat of Saint Ambrose and Charles Borromeo, featuring the magnificent Duomo where Saint Augustine was baptized.","","https://raw.githubusercontent.com/mmm777/destinationes-places/main/blue%20flag%20light.png"
"Los Angeles",34.0574619,-118.2453146,"Los Angeles serves as a major Catholic pilgrimage center with the magnificent Cathedral of Our Lady of the Angels and historic California missions offering spiritual significance.","","https://raw.githubusercontent.com/mmm777/destinationes-places/main/blue%20flag%20light.png"
"Manaoag",16.0439452,120.4884288,"Manaoag is home to the miraculous Our Lady of the Rosary, drawing millions of pilgrims seeking Marian intercession and healing graces.","","https://raw.githubusercontent.com/mmm777/destinationes-places/main/blue%20flag%20light.png"
"Chennai",13.0335957,80.27768940000001,"Chennai holds special significance as the site where St. Thomas the Apostle was martyred and buried, making it one of Christianity's most important pilgrimage destinations in India.","","https://raw.githubusercontent.com/mmm777/destinationes-places/main/blue%20flag%20light.png"
"Annaba",36.881805,7.744749,"Annaba hosts the Basilica of Saint Augustine, North Africa's chief Catholic pilgrimage site honoring the great Doctor of the Church.","","https://raw.githubusercontent.com/mmm777/destinationes-places/main/blue%20flag%20light.png"
"Ramsgate",51.3283418,1.4101637,"Ramsgate hosts the official Shrine of St Augustine of England, commemorating where the Apostle of the English first brought Christianity in 597 AD.","","https://raw.githubusercontent.com/mmm777/destinationes-places/main/blue%20flag%20light.png"
"Salerno",40.6801603,14.760049,"Salerno is home to the revered Cathedral of Saint Matthew, housing the apostle's relics since 954 AD, making it a significant medieval pilgrimage destination in southern Italy.","","https://raw.githubusercontent.com/mmm777/destinationes-places/main/blue%20flag%20light.png"
"Ortona",42.3571323,14.404454,"Ortona houses the relics of St. Thomas the Apostle in its cathedral, making it a major pilgrimage destination for Christians worldwide seeking spiritual connection.","","https://raw.githubusercontent.com/mmm777/destinationes-places/main/blue%20flag%20light.png"
"Trier",49.7563453,6.6431337,"Trier Cathedral houses the Holy Robe of Christ, drawing pilgrims for 500 years to Germany's oldest bishop's church and sanctuary.","","https://raw.githubusercontent.com/mmm777/destinationes-places/main/blue%20flag%20light.png"
"Patras",38.2423991,21.7278516,"Patras holds profound Catholic significance as the final resting place of Saint Andrew the Apostle, whose relics draw Christian pilgrims worldwide to venerate this first-called disciple.","","https://raw.githubusercontent.com/mmm777/destinationes-places/main/blue%20flag%20light.png"
"Amalfi",40.6344504,14.6029926,"Amalfi hosts the magnificent Cathedral of Saint Andrew, housing the apostle's relics and serving as a major Catholic pilgrimage site on Italy's stunning Amalfi Coast.","","https://raw.githubusercontent.com/mmm777/destinationes-places/main/blue%20flag%20light.png"
"Saint Catherine",28.5559484,33.976048,"Saint Catherine's Monastery houses the relics of St. Catherine of Alexandria and marks the biblical Mount Sinai, making it one of Christianity's most ancient pilgrimage sites.","","https://raw.githubusercontent.com/mmm777/destinationes-places/main/blue%20flag%20light.png"
"Benevento",41.1317813,14.7745263,"Benevento is a historic Catholic pilgrimage site in southern Italy, home to the cathedral where Saint Padre Pio was ordained and the ancient Lombard Church of Santa Sophia.","","https://raw.githubusercontent.com/mmm777/destinationes-places/main/blue%20flag%20light.png"
"Pavia",45.1913577,9.1546138,"Pavia houses the tomb of St. Augustine of Hippo in San Pietro in Ciel d'Oro, making it a significant pilgrimage destination for Catholics seeking the Doctor of the Church's intercession.","","https://raw.githubusercontent.com/mmm777/destinationes-places/main/blue%20flag%20light.png"
"Alexandria",31.1947439,29.8944954,"Alexandria holds profound Catholic significance as the historical seat of St. Mark the Evangelist and center of early Christianity, with St. Catherine's Cathedral serving as the main Catholic pilgrimage destination.","","https://raw.githubusercontent.com/mmm777/destinationes-places/main/blue%20flag%20light.png"
"Mercogliano",40.9357016,14.7283161,"Mercogliano is home to the famous Sanctuary of Montevergine, one of Italy's most important Marian shrines and a Benedictine territorial abbey that has drawn pilgrims for centuries.","","https://raw.githubusercontent.com/mmm777/destinationes-places/main/blue%20flag%20light.png"
"Syracuse",37.0747537,15.2855387,"Home to the miraculous Basilica of Our Lady of Tears, Syracuse offers pilgrims a profound encounter with Marian devotion and modern Catholic miracles in historic Sicily.","","https://raw.githubusercontent.com/mmm777/destinationes-places/main/blue%20flag%20light.png"
"Kalisz",51.7634082,18.0932204,"Kalisz hosts Poland's National Shrine of St. Joseph, one of the world's oldest sanctuaries dedicated to Jesus' earthly father, drawing pilgrims seeking St. Joseph's intercession.","","https://raw.githubusercontent.com/mmm777/destinationes-places/main/blue%20flag%20light.png"
"Braga",41.5547347,-8.3770546,"Braga, known as the 'Portuguese Rome,' is home to magnificent sanctuaries and churches that have attracted Catholic pilgrims for centuries.","","https://raw.githubusercontent.com/mmm777/destinationes-places/main/blue%20flag%20light.png"
"Banska Štiavnica",48.4616771,18.9132335,"Banská Štiavnica is home to Slovakia's most important Baroque pilgrimage complex, the Kalvária Calvary with its three churches and 22 chapels.","","https://raw.githubusercontent.com/mmm777/destinationes-places/main/blue%20flag%20light.png"
"Congonhas",-20.5073596,-43.8606338,"Congonhas is renowned for its UNESCO World Heritage Sanctuary of Bom Jesus de Matosinhos, a magnificent 18th-century Baroque church featuring Aleijadinho's celebrated soapstone sculptures depicting the Stations of the Cross.","","https://raw.githubusercontent.com/mmm777/destinationes-places/main/blue%20flag%20light.png"
"Predaia",46.3689663,11.1064674,"Predaia is home to the magnificent Sanctuary of San Romedio, a medieval pilgrimage site clinging to a rocky cliff where Saint Romedius lived as a hermit.","","https://raw.githubusercontent.com/mmm777/destinationes-places/main/blue%20flag%20light.png"
"Oberammergau",47.5962079,11.0659378,"Oberammergau is renowned for its Passion Play performed every decade since 1634, making it a significant Catholic pilgrimage destination in Bavaria.","","https://raw.githubusercontent.com/mmm777/destinationes-places/main/blue%20flag%20light.png"
"L'Aquila",42.3427127,13.404685,"L'Aquila is home to the tomb of Pope Celestine V and hosts the annual Celestinian Forgiveness pilgrimage dating back to 1294.","","https://raw.githubusercontent.com/mmm777/destinationes-places/main/blue%20flag%20light.png"
"Warfhuizen",53.3427819,6.4250318,"Warfhuizen hosts the northernmost Marian shrine in continental Europe, featuring the Sorrowful Mother statue at Our Lady of the Enclosed Garden hermitage.","https://www.destinationes.com/pilgrimage-sites/Warfhuizen","https://raw.githubusercontent.com/mmm777/destinationes-places/main/blue%20flag%20light.png"
"Guardialfiera",41.8016468,14.7934721,"Guardialfiera is a historic Catholic pilgrimage site in Molise, home to the ancient Cathedral of Santa Maria Assunta which houses precious relics of Saint Gaudentius.","","https://raw.githubusercontent.com/mmm777/destinationes-places/main/blue%20flag%20light.png"
"Belleville",38.5612988,-90.0921231,"Belleville hosts the National Shrine of Our Lady of the Snows, a major Catholic pilgrimage destination with beautiful devotional spaces.","","https://raw.githubusercontent.com/mmm777/destinationes-places/main/blue%20flag%20light.png"
"Québec City",46.8139,-71.208,"Québec City is North America's oldest Catholic pilgrimage destination with over 350 years of faith, featuring the renowned Sainte-Anne-de-Beaupré Shrine.","","https://raw.githubusercontent.com/mmm777/destinationes-places/main/blue%20flag%20light.png"
"Guanajuato (Cristo Rey)",21.0117523,-101.3688703,"The Cristo Rey sanctuary on Cerro del Cubilete is one of Mexico's most important Catholic pilgrimage sites, commemorating the Cristero War martyrs.","","https://raw.githubusercontent.com/mmm777/destinationes-places/main/blue%20flag%20light.png"
"San Juan",26.1968756,-98.1551106,"San Juan, Texas is home to the Basilica of Our Lady of San Juan del Valle, a major Catholic pilgrimage site welcoming over one million visitors annually to honor Our Lady of San Juan.","","https://raw.githubusercontent.com/mmm777/destinationes-places/main/blue%20flag%20light.png"
"San Juan de los Lagos",21.2451933,-102.3341558,"San Juan de los Lagos is Mexico's second most important Catholic pilgrimage site, home to the miraculous Virgin of San Juan de los Lagos.","","https://raw.githubusercontent.com/mmm777/destinationes-places/main/blue%20flag%20light.png"
"Zapopan",20.7212971,-103.392227,"Zapopan houses the miraculous Virgin of Zapopan, drawing millions annually to celebrate her October 12th pilgrimage and basilica sanctuary.","","https://raw.githubusercontent.com/mmm777/destinationes-places/main/blue%20flag%20light.png"
"Fonda",42.9501141,-74.3927741,"Fonda hosts the National Shrine of Saint Kateri Tekakwitha, America's first Native American saint, drawing pilgrims to this sacred Mohawk Valley site.","","https://raw.githubusercontent.com/mmm777/destinationes-places/main/blue%20flag%20light.png"
"Puebla",19.0428904,-98.1983291,"Puebla houses the magnificent Rosary Chapel, considered the crown jewel of Mexican Baroque architecture, drawing countless Catholic pilgrims annually.","","https://raw.githubusercontent.com/mmm777/destinationes-places/main/blue%20flag%20light.png"
"Philadelphia",39.9698296,-75.1449938,"Philadelphia offers rich Catholic pilgrimage heritage, home to the National Shrine of St. John Neumann, the first American male saint, and numerous sacred sites.","","https://raw.githubusercontent.com/mmm777/destinationes-places/main/blue%20flag%20light.png"
"La Crosse",43.7543354,-91.1799979,"La Crosse hosts the magnificent Shrine of Our Lady of Guadalupe, a premier Catholic pilgrimage destination founded by Cardinal Burke.","","https://raw.githubusercontent.com/mmm777/destinationes-places/main/blue%20flag%20light.png"
"Guadalajara",20.6769688,-103.3469068,"Guadalajara stands as a major Catholic pilgrimage center, home to the magnificent Cathedral of the Assumption of Our Lady and millions of faithful visitors annually.","","https://raw.githubusercontent.com/mmm777/destinationes-places/main/blue%20flag%20light.png"
