name,latitude,longitude,description,link,icon
"Trzebnica",51.3094177,17.0666743,"Trzebnica hosts the Sanctuary of Saint Jadwiga, a major Catholic pilgrimage site housing the tomb of Saint Hedwig of Silesia, drawing pilgrims since the 14th century.","","https://raw.githubusercontent.com/mmm777/destinationes-places/main/blue%20flag%20light.png"
"Plovdiv",42.144416,24.752606,"Plovdiv is home to the magnificent Cathedral of St. Louis, the largest Catholic church in Bulgaria and a significant pilgrimage destination.","","https://raw.githubusercontent.com/mmm777/destinationes-places/main/blue%20flag%20light.png"
"Zakopane",49.2849573,19.923007,"Zakopane serves as a spiritual gateway to the Tatra Mountains, featuring the National Shrine of Our Lady of Fatima, built as a votive offering after the 1981 assassination attempt on Pope John Paul II.","","https://raw.githubusercontent.com/mmm777/destinationes-places/main/blue%20flag%20light.png"
"Budslaw",54.7868076,27.4515082,"Budslaw is home to the miraculous Our Lady of Budslau icon, Belarus's national Catholic sanctuary attracting tens of thousands of pilgrims annually.","","https://raw.githubusercontent.com/mmm777/destinationes-places/main/blue%20flag%20light.png"
"Matraverebély-Szentkut",48.000051,19.761423,"Hungary's national Catholic shrine since the 12th century, Matraverebély-Szentkút draws pilgrims to its miraculous spring and Basilica of Our Lady of the Assumption.","","https://raw.githubusercontent.com/mmm777/destinationes-places/main/blue%20flag%20light.png"
"Šibenik",43.7356734,15.8891259,"Šibenik offers pilgrims the magnificent Cathedral of St. James, a UNESCO World Heritage site, and the national shrine dedicated to Croatia's first saint, Nikola Tavelić.","","https://raw.githubusercontent.com/mmm777/destinationes-places/main/blue%20flag%20light.png"
"Góra Świętej Anny",50.4561167,18.168821,"Góra Świętej Anny is a significant Catholic pilgrimage destination featuring a miraculous statue of St. Anne and an impressive calvary with Franciscan monastery.","","https://raw.githubusercontent.com/mmm777/destinationes-places/main/blue%20flag%20light.png"
"Marija Bistrica",46.0045194,16.1195076,"Marija Bistrica is Croatia's largest Marian pilgrimage site, home to the miraculous Black Madonna statue and national shrine.","","https://raw.githubusercontent.com/mmm777/destinationes-places/main/blue%20flag%20light.png"
"Praha","","","","","https://raw.githubusercontent.com/mmm777/destinationes-places/main/blue%20flag%20light.png"
"Brezje",46.3289802,14.2327054,"Brezje is Slovenia's national Marian shrine, home to the Basilica of Mary Help of Christians where pilgrims venerate a miraculous icon since 1865.","","https://raw.githubusercontent.com/mmm777/destinationes-places/main/blue%20flag%20light.png"
"Montréal",45.4921354,-73.6191235,"Montréal is a prominent Catholic pilgrimage destination, home to the ornate Notre-Dame Basilica—famous for its Gothic Revival architecture and intricate interior—and Saint Joseph's Oratory of Mount Royal, the world's largest shrine dedicated to Saint Joseph, attracting millions of visitors annually.","","https://raw.githubusercontent.com/mmm777/destinationes-places/main/blue%20flag%20light.png"
"Cap-de-la-Madeleine",46.3688393,-72.4977046,"Home to Our Lady of the Cape Shrine, Cap-de-la-Madeleine is Canada's national Marian shrine with miraculous origins dating to 1888.","","https://raw.githubusercontent.com/mmm777/destinationes-places/main/blue%20flag%20light.png"
"Kahnawake",45.4156478,-73.6766844,"Kahnawake is home to the National Shrine of Saint Kateri Tekakwitha, the first Native American saint, whose tomb draws Catholic pilgrims seeking her intercession.","","https://raw.githubusercontent.com/mmm777/destinationes-places/main/blue%20flag%20light.png"
"Lac-Bouchette",48.2719444,-72.1919444,"Ermitage Saint-Antoine is a major Catholic pilgrimage site in Quebec, founded in 1907 and known for its miraculous healings and spiritual significance.","","https://raw.githubusercontent.com/mmm777/destinationes-places/main/blue%20flag%20light.png"
"Wakaw",52.6499268,-105.7421209,"St. Theresa Parish, the National Shrine of the Little Flower in Wakaw, Saskatchewan, offers pilgrims a sacred destination for spiritual renewal and devotion.","","https://raw.githubusercontent.com/mmm777/destinationes-places/main/blue%20flag%20light.png"
"Winnipeg",49.9343714,-97.12221579999999,"Winnipeg serves as a significant Catholic pilgrimage destination, home to Canada's second martyr's shrine at St. Joseph's Ukrainian Catholic Church, where the holy relics of Blessed Bishop Vasyl Velychkovsky are enshrined.","","https://raw.githubusercontent.com/mmm777/destinationes-places/main/blue%20flag%20light.png"
"Berdychiv",49.8971044,28.5744201,"Berdychiv is Ukraine's premier Catholic pilgrimage destination, home to the miraculous Our Lady of Berdychiv icon crowned by Pope Benedict XIV in 1756.","","https://raw.githubusercontent.com/mmm777/destinationes-places/main/blue%20flag%20light.png"
"Toronto",43.6549217,-79.3774486,"Toronto offers Catholic pilgrims sacred spaces including St. Michael's Cathedral Basilica and significant shrines honoring Canada's martyrs and Marian devotion.","","https://raw.githubusercontent.com/mmm777/destinationes-places/main/blue%20flag%20light.png"
"Ottawa",45.4300288,-75.6958373,"Ottawa offers Catholic pilgrims the magnificent Notre-Dame Cathedral Basilica, a National Historic Site and spiritual heart of Canada's capital since 1847.","","https://raw.githubusercontent.com/mmm777/destinationes-places/main/blue%20flag%20light.png"
"Midland",44.7366816,-79.8421388,"Midland's Martyrs' Shrine is a national Catholic pilgrimage site honoring eight Jesuit saints martyred over 350 years ago while bringing Christianity to Canada.","","https://raw.githubusercontent.com/mmm777/destinationes-places/main/blue%20flag%20light.png"
"Sainte-Anne-de-Beaupré",47.02387539999999,-70.9287627,"Sainte-Anne-de-Beaupré is North America's oldest Catholic pilgrimage site, drawing over half-million pilgrims annually to venerate St. Anne, grandmother of Jesus.","","https://raw.githubusercontent.com/mmm777/destinationes-places/main/blue%20flag%20light.png"
"Šaštín-Stráže",48.6391982,17.1430355,"Šaštín-Stráže hosts Slovakia's most important Marian shrine, the Basilica of Our Lady of Seven Sorrows, patron saint of Slovakia.","","https://raw.githubusercontent.com/mmm777/destinationes-places/main/blue%20flag%20light.png"
"Pietralcina",41.1967979,14.8501739,"Pietrelcina is the sacred birthplace of Saint Padre Pio, where this beloved 20th-century saint was baptized and spent his formative years, drawing pilgrims seeking spiritual connection.","","https://raw.githubusercontent.com/mmm777/destinationes-places/main/blue%20flag%20light.png"
"Gostyń",51.8855335,17.0352186,"Gostyń is home to the Basilica of Święta Góra, the main Marian sanctuary of the Poznań archdiocese and a masterpiece of Pompeo Ferrari.","","https://raw.githubusercontent.com/mmm777/destinationes-places/main/blue%20flag%20light.png"
"Steingaden",47.6805433,10.9001235,"Steingaden is home to the famous Pilgrimage Church of Wies, built after a miraculous weeping statue was discovered in 1738, attracting Catholic pilgrims seeking the Scourged Saviour's intercession.","","https://raw.githubusercontent.com/mmm777/destinationes-places/main/blue%20flag%20light.png"
"Walldürn",49.5843588,9.3664233,"Walldürn hosts Germany's largest Eucharistic pilgrimage, centered on the famous 1330 blood miracle where Christ appeared on the consecrated host during Mass.","","https://raw.githubusercontent.com/mmm777/destinationes-places/main/blue%20flag%20light.png"
"Durham",54.7732329,-1.5763921,"Durham Cathedral houses the Shrine of St Cuthbert, making it a major pilgrimage destination for Catholics seeking spiritual healing.","","https://raw.githubusercontent.com/mmm777/destinationes-places/main/blue%20flag%20light.png"
"Studzianna",51.53084459999999,20.3673146,"Studzianna is home to a renowned Marian sanctuary with the Basilica of St. Philip Neri and St. John the Baptist, attracting Catholic pilgrims for centuries.","","https://raw.githubusercontent.com/mmm777/destinationes-places/main/blue%20flag%20light.png"
"Kalwaria Zebrzydowska",49.8602129,19.67158,"Kalwaria Zebrzydowska is a remarkable 17th-century Calvary sanctuary known as the 'Polish Jerusalem,' where over a million pilgrims annually pray along its Passion and Marian devotional paths.","","https://raw.githubusercontent.com/mmm777/destinationes-places/main/blue%20flag%20light.png"
"Saint-Gilles",43.676773,4.4322319,"Saint-Gilles was once the fourth most important pilgrimage destination in Christendom, where the relics of Saint Gilles attracted countless pilgrims seeking miracles and blessings.","","https://raw.githubusercontent.com/mmm777/destinationes-places/main/blue%20flag%20light.png"
"Marseille",43.2840325,5.3712573,"Marseille is a major Catholic pilgrimage destination centered around the iconic Notre-Dame de la Garde basilica, known for its Assumption Day pilgrimages and Marian devotion.","","https://raw.githubusercontent.com/mmm777/destinationes-places/main/blue%20flag%20light.png"
"Saint-Maximin-la-Sainte-Baume",43.4526151,5.8637662,"Home to the relics of Saint Mary Magdalene, this major pilgrimage site features a Gothic basilica where pilgrims venerate the remains of the Apostle to the Apostles.","","https://raw.githubusercontent.com/mmm777/destinationes-places/main/blue%20flag%20light.png"
"Burgos",42.340864,-3.7044495,"Burgos Cathedral, a UNESCO World Heritage site, stands as a vital pilgrimage stop on the Camino de Santiago, housing the tomb of El Cid and offering profound spiritual significance for Catholic pilgrims seeking history and divine beauty.","","https://raw.githubusercontent.com/mmm777/destinationes-places/main/blue%20flag%20light.png"
"Vadstena",58.4507577,14.8915135,"Vadstena is home to the medieval Vadstena Abbey, founded by Saint Bridget of Sweden in the 14th century, making it a significant Catholic pilgrimage site.","","https://raw.githubusercontent.com/mmm777/destinationes-places/main/blue%20flag%20light.png"
"Avignon",43.9516103,4.8074811,"Avignon served as the seat of seven Popes from 1309-1378, making it a pivotal center of Catholic Church history. The city's magnificent Palace of the Popes and cathedral continue to attract faithful pilgrims seeking connection to this papal legacy.","","https://raw.githubusercontent.com/mmm777/destinationes-places/main/blue%20flag%20light.png"
"Orvieto",42.7170784,12.1133109,"Orvieto is famed for the Eucharistic Miracle of Bolsena, with relics preserved in its magnificent Gothic cathedral, drawing pilgrims worldwide.","","https://raw.githubusercontent.com/mmm777/destinationes-places/main/blue%20flag%20light.png"
"Kalwaria Pacławska",49.6313761,22.7074214,"Kalwaria Pacławska is a historic Catholic pilgrimage center known as the 'Jerusalem of the East,' featuring miraculous Marian devotions.","","https://raw.githubusercontent.com/mmm777/destinationes-places/main/blue%20flag%20light.png"
"Caravaca de la Cruz",38.1076948,-1.858685,"Caravaca de la Cruz is one of only five Holy Cities in the Catholic world, home to the miraculous Vera Cross relic and pilgrimage destination.","","https://raw.githubusercontent.com/mmm777/destinationes-places/main/blue%20flag%20light.png"
"Toledo",39.8571004,-4.0235688,"Toledo stands as the historic heart of Spanish Catholicism, home to the magnificent Primatial Cathedral and serving as a center of Christian art and pilgrimage since the Reconquista.","","https://raw.githubusercontent.com/mmm777/destinationes-places/main/blue%20flag%20light.png"
"Licheń Stary",52.3233124,18.3578532,"Licheń Stary is Poland's largest Marian pilgrimage site, home to the magnificent Basilica of Our Lady of Licheń and the revered icon of Our Lady of Sorrows.","","https://raw.githubusercontent.com/mmm777/destinationes-places/main/blue%20flag%20light.png"
"Plan-d'Aups-Sainte-Baume",43.3269,5.7644,"Plan-d'Aups-Sainte-Baume is home to the ancient grotto where Mary Magdalene lived as a hermit, making it one of Christianity's oldest pilgrimage sites.","","https://raw.githubusercontent.com/mmm777/destinationes-places/main/blue%20flag%20light.png"
"Aachen",50.7747198,6.083920099999999,"Aachen Cathedral houses four great relics and hosts the Heiligtumsfahrt pilgrimage every seven years since 1349, attracting faithful to venerate treasures collected by Charlemagne.","","https://raw.githubusercontent.com/mmm777/destinationes-places/main/blue%20flag%20light.png"
"Studzieniczna",53.8590983,23.0939591,"Studzieniczna is a renowned Marian pilgrimage site famous for its miraculous image of Our Lady and healing spring waters, visited by Pope John Paul II in 1999.","","https://raw.githubusercontent.com/mmm777/destinationes-places/main/blue%20flag%20light.png"
"Naples",40.8525429,14.2593205,"Naples Cathedral houses the miraculous blood of Saint Januarius and serves as the spiritual heart of Neapolitan Catholic devotion.","","https://raw.githubusercontent.com/mmm777/destinationes-places/main/blue%20flag%20light.png"
"Žemaičių Kalvarija",56.1097585,22.0114951,"Žemaičių Kalvarija is Lithuania's most important Catholic pilgrimage site, featuring the first Calvary in the Grand Duchy with its miraculous Holy Cross relic.","","https://raw.githubusercontent.com/mmm777/destinationes-places/main/blue%20flag%20light.png"
"Tronheim",63.4269097,10.3969375,"Trondheim houses Nidaros Cathedral, built over St. Olav's tomb, making it Norway's most important Catholic pilgrimage destination and northern Europe's premier medieval shrine.","","https://raw.githubusercontent.com/mmm777/destinationes-places/main/blue%20flag%20light.png"
"Santo Toribio de Liébana",43.15020320000001,-4.6539393,"Santo Toribio de Liébana monastery houses the largest known relic of the True Cross, making it one of Catholicism's five holy sites with perpetual indulgences.","","https://raw.githubusercontent.com/mmm777/destinationes-places/main/blue%20flag%20light.png"
"Godów",49.9117015,18.500623,"Godów is home to the historic wooden St. Anne's Church, a significant Catholic pilgrimage site in Silesia featuring religious art and sacred relics.","","https://raw.githubusercontent.com/mmm777/destinationes-places/main/blue%20flag%20light.png"
"Lindisfarne",55.6692334,-1.8020177,"Lindisfarne, also known as Holy Island, is a sacred pilgrimage site where St. Aidan founded the first Celtic Christian monastery in 635 AD.","","https://raw.githubusercontent.com/mmm777/destinationes-places/main/blue%20flag%20light.png"
"St Andrews",56.3394924,-2.7884731,"St Andrews holds profound Catholic significance as Scotland's premier pilgrimage destination where Saint Andrew's relics drew medieval pilgrims.","","https://raw.githubusercontent.com/mmm777/destinationes-places/main/blue%20flag%20light.png"
"Lubaczów",50.1568684,23.1244317,"Lubaczów is a significant Catholic pilgrimage destination in southeastern Poland, known for its Sanctuary of Our Lady of Graces and the nearby Sanctuary of Our Lady of Łukawiec.","","https://raw.githubusercontent.com/mmm777/destinationes-places/main/blue%20flag%20light.png"
"Viru-Nigula",59.4445642,26.7017262,"Viru-Nigula is Estonia's oldest Marian sanctuary, housing the ruins of 13th-century St. Mary's Chapel and hosting annual Catholic pilgrimages.","","https://raw.githubusercontent.com/mmm777/destinationes-places/main/blue%20flag%20light.png"
"Whithorn",54.7337383,-4.4175087,"Whithorn is Scotland's earliest Christian pilgrimage site, home to St Ninian's shrine and Candida Casa, drawing pilgrims for over 1,600 years to seek healing and spiritual renewal.","","https://raw.githubusercontent.com/mmm777/destinationes-places/main/blue%20flag%20light.png"
"Glasgow",55.8630024,-4.2345823,"Glasgow offers profound Catholic heritage with its medieval cathedral housing St Mungo's shrine, drawing pilgrims for centuries to Scotland's spiritual heart.","","https://raw.githubusercontent.com/mmm777/destinationes-places/main/blue%20flag%20light.png"
"Taizé",46.5157002,4.6779804,"Taizé is one of the world's most important Christian pilgrimage sites, attracting over 100,000 young people annually for prayer and reconciliation.","","https://raw.githubusercontent.com/mmm777/destinationes-places/main/blue%20flag%20light.png"
"Dukla",49.5594974,21.6821031,"Dukla is a significant Catholic pilgrimage site honoring St. John of Dukla, a 15th-century Franciscan saint canonized by Pope John Paul II in 1997.","","https://raw.githubusercontent.com/mmm777/destinationes-places/main/blue%20flag%20light.png"
"Wadowice",49.8835679,19.4937889,"Wadowice is the birthplace of Saint John Paul II, where pilgrims visit the basilica of his baptism and family home to honor the beloved pontiff's spiritual origins.","","https://raw.githubusercontent.com/mmm777/destinationes-places/main/blue%20flag%20light.png"
"Penrhys ",51.6414181,-3.4433783,"Penrhys is an ancient Catholic pilgrimage site high in the Rhondda Valley, famous for its miraculous statue of Our Lady and holy well dating to medieval times.","","https://raw.githubusercontent.com/mmm777/destinationes-places/main/blue%20flag%20light.png"
"Avila",40.65549499999999,-4.7027556,"Ávila is the birthplace of St. Teresa of Ávila, renowned Doctor of the Church, and home to her relics and numerous sites associated with her mystical life.","","https://raw.githubusercontent.com/mmm777/destinationes-places/main/blue%20flag%20light.png"
"Hill of the Crosses (Kryžių kalnas)",56.01533569999999,23.4163579,"The Hill of Crosses is Lithuania's national pilgrimage center, where over 100,000 crosses testify to Catholic faith and peaceful resistance.","","https://raw.githubusercontent.com/mmm777/destinationes-places/main/blue%20flag%20light.png"
"Turin",45.0733813,7.6852268,"Turin is renowned as the guardian of the Holy Shroud, believed to be Christ's burial cloth, drawing Catholic pilgrims worldwide to venerate this sacred relic.","","https://raw.githubusercontent.com/mmm777/destinationes-places/main/blue%20flag%20light.png"
"Kirkkokari (Saint Henry's Island)",61.1166667,22.3333333,"Kirkkokari (Saint Henry's Island) is Finland's only Catholic pilgrimage site, marking the martyrdom of Bishop Henry in 1156. Medieval chapel foundations and modern altars commemorate this sacred place.","","https://raw.githubusercontent.com/mmm777/destinationes-places/main/blue%20flag%20light.png"
"Monte Sant'Angelo",41.7080134,15.9547699,"Monte Sant'Angelo hosts the oldest shrine in Western Europe dedicated to Archangel Michael, where tradition holds the celestial being consecrated the sanctuary himself.","","https://raw.githubusercontent.com/mmm777/destinationes-places/main/blue%20flag%20light.png"
"Kildare",53.1578539,-6.9113453,"Kildare is home to St. Brigid's Cathedral, built on the site of Ireland's famous 5th-century monastery founded by St. Brigid, patroness of Ireland.","","https://raw.githubusercontent.com/mmm777/destinationes-places/main/blue%20flag%20light.png"
"San Giovanni Rotondo",41.7070824,15.7029987,"San Giovanni Rotondo is home to Saint Padre Pio's shrine, drawing millions to venerate this beloved stigmatic priest and experience his spiritual legacy.","","https://raw.githubusercontent.com/mmm777/destinationes-places/main/blue%20flag%20light.png"
"Krasnobród",50.5396214,23.2284018,"Krasnobród is home to the historic Shrine of Our Lady of the Visitation, a baroque sanctuary founded by Queen Marie Casimire Sobieska and a significant Catholic pilgrimage destination in southeastern Poland.","","https://raw.githubusercontent.com/mmm777/destinationes-places/main/blue%20flag%20light.png"
"Loyola",43.1744919,-2.2823503,"Loyola is the birthplace of St. Ignatius of Loyola, founder of the Jesuit Order. The magnificent Baroque sanctuary surrounds his holy birthplace.","","https://raw.githubusercontent.com/mmm777/destinationes-places/main/blue%20flag%20light.png"
"Bari",41.13031369999999,16.8701375,"Bari is home to the Basilica of Saint Nicholas, housing the relics of Saint Nicholas, making it one of Europe's most important Catholic pilgrimage destinations.","","https://raw.githubusercontent.com/mmm777/destinationes-places/main/blue%20flag%20light.png"
"Kodeń",51.9138548,23.607468,"Kodeń is a renowned Catholic pilgrimage site home to the miraculous icon of Our Lady of Kodeń, drawing faithful seeking Marian intercession.","","https://raw.githubusercontent.com/mmm777/destinationes-places/main/blue%20flag%20light.png"
"Lębork",54.5448501,17.7508984,"Lębork's Sanctuary of St. Jacob the Apostle has been a medieval pilgrimage center on the route to Santiago de Compostella, featuring a 14th-century Gothic church with sacred relics.","","https://raw.githubusercontent.com/mmm777/destinationes-places/main/blue%20flag%20light.png"
"Caceres",39.45234809999999,-5.3273457,"Cáceres is home to the Royal Monastery of Santa María de Guadalupe, a UNESCO World Heritage site and one of Spain's most important Catholic pilgrimage destinations, housing the revered image of Our Lady of Guadalupe, Patron Saint of Extremadura.","","https://raw.githubusercontent.com/mmm777/destinationes-places/main/blue%20flag%20light.png"
"Nevers",46.9917,3.1525,"Nevers is a significant Catholic pilgrimage site housing the incorrupt body of Saint Bernadette Soubirous, visionary of Lourdes.","","https://raw.githubusercontent.com/mmm777/destinationes-places/main/blue%20flag%20light.png"
"Gniezno",52.5367048,17.5928042,"Gniezno, the cradle of Polish Christianity, hosts the shrine of St. Adalbert and served as the coronation site for Polish kings.","","https://raw.githubusercontent.com/mmm777/destinationes-places/main/blue%20flag%20light.png"
"Iona",56.3348978,-6.3918449,"Iona Abbey, founded by St. Columba in 563 AD, stands as one of Scotland's most sacred pilgrimage sites where Celtic Christianity flourished.","","https://raw.githubusercontent.com/mmm777/destinationes-places/main/blue%20flag%20light.png"
"Tuchów",49.9010742,21.0598304,"Tuchów is home to a renowned Marian sanctuary with a miraculous 16th-century icon, drawing pilgrims for its spiritual significance.","","https://raw.githubusercontent.com/mmm777/destinationes-places/main/blue%20flag%20light.png"
"Wambierzyce",50.4902002,16.4548254,"Wambierzyce is known as 'Silesian Jerusalem' and features a miraculous Marian shrine with centuries of pilgrimage tradition.","","https://raw.githubusercontent.com/mmm777/destinationes-places/main/blue%20flag%20light.png"
"Lyon",45.7623343,4.821982999999999,"Lyon serves as a significant Catholic pilgrimage destination, home to the historic Basilica of Notre-Dame de Fourvière, a popular Marian shrine since 1170 that attracts pilgrims seeking spiritual reflection.","","https://raw.githubusercontent.com/mmm777/destinationes-places/main/blue%20flag%20light.png"
"Tours",47.3928833,0.6828131,"Tours houses the tomb of St. Martin of Tours, the 4th-century bishop renowned as the 'Apostle of Gaul,' making it a major pilgrimage site since the Middle Ages.","","https://raw.githubusercontent.com/mmm777/destinationes-places/main/blue%20flag%20light.png"
"Piekary Śląskie",50.3838117,18.9444366,"Piekary Śląskie is one of Poland's most important Marian shrines, drawing thousands of pilgrims annually to the miraculous image of Our Lady of Justice and Social Love (Matka Sprawiedliwości i Miłości Społeczne).","","https://raw.githubusercontent.com/mmm777/destinationes-places/main/blue%20flag%20light.png"
"Seville",37.3858247,-5.9931068,"Seville's magnificent Cathedral houses the tomb of Saint Ferdinand III and draws pilgrims during Holy Week processions.","","https://raw.githubusercontent.com/mmm777/destinationes-places/main/blue%20flag%20light.png"
"Montecassino",41.4912295,13.8145781,"Montecassino Abbey, founded by St. Benedict in 529, is the birthplace of Western monasticism and houses the tombs of St. Benedict and St. Scholastica.","","https://raw.githubusercontent.com/mmm777/destinationes-places/main/blue%20flag%20light.png"
"Kevelaer",51.5844672,6.2445232,"Kevelaer is Germany's largest Catholic pilgrimage destination, where Our Lady of Consolation has been venerated since 1641 following miraculous apparitions and healings.","","https://raw.githubusercontent.com/mmm777/destinationes-places/main/blue%20flag%20light.png"
"Cascia",42.7187901,13.0125592,"Cascia is a renowned Catholic pilgrimage site in Umbria, home to Saint Rita and housing the miraculous Eucharistic Miracle, drawing the faithful worldwide.","","https://raw.githubusercontent.com/mmm777/destinationes-places/main/blue%20flag%20light.png"
"Trakai",54.64276169999999,24.9341206,"Trakai hosts the miraculous Trakai Mother of God icon, crowned by Pope Clement XI in 1718, drawing pilgrims since the 17th century to its renowned basilica.","","https://raw.githubusercontent.com/mmm777/destinationes-places/main/blue%20flag%20light.png"
"Bamberg",49.8908017,10.8824646,"Bamberg is a significant Catholic pilgrimage destination housing the tomb of Emperor Henry II and Pope Clement II in its magnificent cathedral.","","https://raw.githubusercontent.com/mmm777/destinationes-places/main/blue%20flag%20light.png"
"Gidle",50.96552430000001,19.470226,"Gidle houses a renowned Dominican monastery with the miraculous figure of Our Lady, drawing Catholic pilgrims from across Poland seeking Marian devotion.","","https://raw.githubusercontent.com/mmm777/destinationes-places/main/blue%20flag%20light.png"
"Kałków",50.96360199999999,21.1733093,"Kałków is home to the Sanctuary of Our Lady of Sorrows, Queen of Poland, a major Marian pilgrimage site with miraculous icon and religious complex.","","https://raw.githubusercontent.com/mmm777/destinationes-places/main/blue%20flag%20light.png"
